{
  "$schema": "../schemas/npc.schema.json",
  "slug": "huntsman",
  "name": "Huntsman",
  "blurb": "Wild Hunt verderer carrying a Fae Title (CtL p.262).",
  "book": "CtL 2e p.262",
  "tier": "storyteller",
  "lineage": "huntsman",
  "tags": ["lost", "hunt", "fae", "antagonist"],
  "attributes": {
    "intelligence": 3,
    "wits": 4,
    "resolve": 4,
    "strength": 4,
    "dexterity": 4,
    "stamina": 3,
    "presence": 3,
    "manipulation": 3,
    "composure": 3
  },
  "skills": {
    "survival": 4,
    "stealth": 3,
    "athletics": 3,
    "brawl": 2,
    "weaponry": 3,
    "intimidation": 3,
    "investigation": 2,
    "animal ken": 2
  },
  "integrity": 5,
  "size": 5,
  "defaultWeapon": "spear",
  "shortDesc": "A tall figure with a hunter's patience and something wrong in the eyes.",
  "description": "Cold iron and briars. It does not tire. It does not forget.",
  "ai": {
    "archetype": "azlu-stalker",
    "startRevealed": false
  },
  "defaults": {
    "aggro": "hunter",
    "presence": "hidden",
    "lookMode": "mask"
  },
  "changeling": {
    "seeming": "",
    "kith": "",
    "court": "",
    "wyrd": 4,
    "glamour": 12,
    "clarity": 5
  },
  "dreadPowers": [
    "mortal-mask",
    "regeneration"
  ]
}
